{
  "id": "uci-worldtour",
  "aliases": [
    "worldtour",
    "uci world tour",
    "men's worldtour",
    "world team"
  ],
  "sportId": "cycling",
  "name": "UCI WorldTour (men's road cycling)",
  "clubCount": 18,
  "season": "2026",
  "status": "partial",
  "notes": [
    "18 UCI WorldTeams granted 2026-2028 licences by the UCI Licence Commission (UCI press release, 2026-2028 cycle).",
    "Every team is named after a sponsor; names change with sponsors.",
    "Sponsor placement here is mapped to the schema's front/back/sleeve/shorts/partner values from 'team title/name' and 'jersey'."
  ]
}
